{
  "version": 1,
  "issue_id": "Ib_dEtzGi",
  "category": "love",
  "title": "task1",
  "description": "test",
  "status": "Open",
  "priority": "Medium",
  "origin_company": "Vendor",
  "assignee": "yokobori",
  "created_at": "2025-12-30T13:07:47+09:00",
  "updated_at": "2025-12-30T13:07:47+09:00",
  "due_date": "2024-11-10",
  "comments": []
}
